comboId,req1Id,req1,req_1,req2Id,req2,req_2,Label,AnnotationStatus
43360,106074,Helper App Management,helper app management,1360474,[UX] Updating from a new user tour in Firefox 56 to a new user tour in Firefox 57, ux  updating from a new user tour in firefox 56 to a new user tour in firefox 57,0.0,M
12897,106074,Helper App Management,helper app management,1349555,Make tabs rectangular (remove tab curve),make tabs rectangular  remove tab curve ,0.0,M
37270,106074,Helper App Management,helper app management,1528953,Add pref to opt out of recommended features,add pref to opt out of recommended features,0.0,M
51816,185618,Offer choice to open natively with Content-Disposition: attachment (View/Show in browser),offer choice to open natively with content disposition  attachment  view show in browser ,1463755,Update the design of certificate error pages,update the design of certificate error pages,0.0,M
46112,185618,Offer choice to open natively with Content-Disposition: attachment (View/Show in browser),offer choice to open natively with content disposition  attachment  view show in browser ,1492179,"Drag browser/base/content/test/general/browser_bug767836_perwindowpb.js into an async/task/promise/e10s world, and make it not accidentally hit about:blank",drag browser base content test general browser bug767836 perwindowpb js into an async task promise e10s world  and make it not accidentally hit about blank,0.0,M
36315,106074,Helper App Management,helper app management,1479478,Exclude default search URLs from topsites,exclude default search urls from topsites,0.0,M
8546,115041,support %u in mailcap helpers,support  u in mailcap helpers,1435588,Override `applyIncomingBatch` in the buffered bookmarks engine to insert all incoming records at once,override  applyincomingbatch  in the buffered bookmarks engine to insert all incoming records at once,0.0,M
5371,106074,Helper App Management,helper app management,1458066,Implement ability to move a selection of tabs within the same window through drag and drop,implement ability to move a selection of tabs within the same window through drag and drop,0.0,M
19509,142179,"Cookie Manager: sort ""Cookie Sites"" should sort by Domain (TLD -> left, as labels, not strings, etc.)",cookie manager  sort  cookie sites  should sort by domain  tld    left  as labels  not strings  etc  ,1512652,Implement URL canonizing via Ctrl key,implement url canonizing via ctrl key,0.0,M
14474,185618,Offer choice to open natively with Content-Disposition: attachment (View/Show in browser),offer choice to open natively with content disposition  attachment  view show in browser ,1502389,Allow the view to limit searches to specific providers,allow the view to limit searches to specific providers,0.0,M
50853,70501,The middle mouse button should work more consistently (also ctrl+click),the middle mouse button should work more consistently  also ctrl click ,1458249,Add autoplay item to about:preferences,add autoplay item to about preferences,0.0,M
26552,142179,"Cookie Manager: sort ""Cookie Sites"" should sort by Domain (TLD -> left, as labels, not strings, etc.)",cookie manager  sort  cookie sites  should sort by domain  tld    left  as labels  not strings  etc  ,1373331,WebExtension browserAction icons causes flickering right after first paint,webextension browseraction icons causes flickering right after first paint,0.0,M
36705,185618,Offer choice to open natively with Content-Disposition: attachment (View/Show in browser),offer choice to open natively with content disposition  attachment  view show in browser ,1498451,Use fluent for Device Manager Dialog,use fluent for device manager dialog,0.0,M
36744,106074,Helper App Management,helper app management,1489282,Create a preferences module that can be used across all components,create a preferences module that can be used across all components,0.0,M
46975,142179,"Cookie Manager: sort ""Cookie Sites"" should sort by Domain (TLD -> left, as labels, not strings, etc.)",cookie manager  sort  cookie sites  should sort by domain  tld    left  as labels  not strings  etc  ,1390874,Run browser_startup_images.js on double device pixel ratio,run browser startup images js on double device pixel ratio,0.0,M
9268,106074,Helper App Management,helper app management,1571457,"The Search Bar is no longer ""stuck"" to the top when scrolling down the page when the Extended Triplets are displayed",the search bar is no longer  stuck  to the top when scrolling down the page when the extended triplets are displayed,0.0,M
30915,106074,Helper App Management,helper app management,1435261,Remove OfflineResourceList.webidl interface over insecure contexts,remove offlineresourcelist webidl interface over insecure contexts,0.0,M
11993,106074,Helper App Management,helper app management,1358303,"[ux] error: invalid URL copy,  design and illustration update", ux  error  invalid url copy   design and illustration update,0.0,M
19801,106074,Helper App Management,helper app management,1410828,"Add automated test for ""Hover and `Dismiss` Top Sites tile""",add automated test for  hover and  dismiss  top sites tile ,0.0,M
8183,70501,The middle mouse button should work more consistently (also ctrl+click),the middle mouse button should work more consistently  also ctrl click ,1478750,Add test coverage for closing one payment dialog and completing payment from another,add test coverage for closing one payment dialog and completing payment from another,0.0,M
1911,70501,The middle mouse button should work more consistently (also ctrl+click),the middle mouse button should work more consistently  also ctrl click ,1458067,Implement ability to bookmark a selection of tabs,implement ability to bookmark a selection of tabs,0.0,M
30581,125419,"[META]Add AppleScript support and capabilities to Mozilla on Mac, e.g. AppleScript/OSA Script menu", meta add applescript support and capabilities to mozilla on mac  e g  applescript osa script menu,500052,Sync DOM storage,sync dom storage,0.0,M
53247,125419,"[META]Add AppleScript support and capabilities to Mozilla on Mac, e.g. AppleScript/OSA Script menu", meta add applescript support and capabilities to mozilla on mac  e g  applescript osa script menu,1535694,Upload CFR messages to Remote Settings,upload cfr messages to remote settings,0.0,M
55991,106074,Helper App Management,helper app management,1459603,"Persistent storage prompts should not have a ""Remember this decision"" checkbox",persistent storage prompts should not have a  remember this decision  checkbox,0.0,M
51358,191000,[RFE] allow users to override mime type for gz and other suffixes, rfe  allow users to override mime type for gz and other suffixes,1401346,Move browser/base/content/illustrations to browser/themes/shared,move browser base content illustrations to browser themes shared,0.0,M
19984,152289,new Filepicker filters for Nvu,new filepicker filters for nvu,1373331,WebExtension browserAction icons causes flickering right after first paint,webextension browseraction icons causes flickering right after first paint,0.0,M
40192,297643,Context menu option to open link/image using an external application,context menu option to open link image using an external application,1477771,4 extension cards to test in a SHIELD experiment (for engagement and retention),4 extension cards to test in a shield experiment  for engagement and retention ,0.0,M
22756,70501,The middle mouse button should work more consistently (also ctrl+click),the middle mouse button should work more consistently  also ctrl click ,1440508,"Remove setTabTitleLoading function from tabbrowser, which is marked for removal after 57",remove settabtitleloading function from tabbrowser  which is marked for removal after 57,0.0,M
48424,106074,Helper App Management,helper app management,1476616,SessionStore.setTabState should serialize principals,sessionstore settabstate should serialize principals,0.0,M
13893,125419,"[META]Add AppleScript support and capabilities to Mozilla on Mac, e.g. AppleScript/OSA Script menu", meta add applescript support and capabilities to mozilla on mac  e g  applescript osa script menu,1498378,Actually remove the old onboarding add-on's prefs,actually remove the old onboarding add on s prefs,0.0,M
6221,70501,The middle mouse button should work more consistently (also ctrl+click),the middle mouse button should work more consistently  also ctrl click ,1456136,Add support for remote snippet provider in AS router,add support for remote snippet provider in as router,0.0,M
52922,106074,Helper App Management,helper app management,1462372,[meta] Integrate anti-tracking with developer tools, meta  integrate anti tracking with developer tools,0.0,M
26223,152289,new Filepicker filters for Nvu,new filepicker filters for nvu,1354157,Add a 'Show Library' button to the Library panel,add a  show library  button to the library panel,0.0,M
10890,106074,Helper App Management,helper app management,1419505,Allow cloning Sync sessions when cloning profiles.,allow cloning sync sessions when cloning profiles ,0.0,M
18453,70501,The middle mouse button should work more consistently (also ctrl+click),the middle mouse button should work more consistently  also ctrl click ,1361713,Pre-aggregate telemetry data to expose to UITour without impacting performance,pre aggregate telemetry data to expose to uitour without impacting performance,0.0,M
8648,125419,"[META]Add AppleScript support and capabilities to Mozilla on Mac, e.g. AppleScript/OSA Script menu", meta add applescript support and capabilities to mozilla on mac  e g  applescript osa script menu,1400960,Use animationend to handle end of DownloadsIndicatorView notification animation,use animationend to handle end of downloadsindicatorview notification animation,0.0,M
48261,106074,Helper App Management,helper app management,1483059,Add snippets targeting for specific Top URLs,add snippets targeting for specific top urls,0.0,M
