comboId,req1Id,req1,req_1,req2Id,req2,req_2,Label,AnnotationStatus
39610.0,415463.0,"Dock menu support for Mac OS X (add ""New Window"" menu item)",dock menu support for mac os x  add  new window  menu item ,435680.0,RFE: Open a new window via selection option on the Firefox Dock Icon when right clicking on said icon,rfe  open a new window via selection option on the firefox dock icon when right clicking on said icon,2.0,M
47146.0,282220.0,"Sort domain lists (cookies, exceptions, saved passwords, etc) in reverse DNS order (optionally?)",sort domain lists  cookies  exceptions  saved passwords  etc  in reverse dns order  optionally  ,346127.0,Sort registered websites in the cookie manager on domain (rather than subdomain),sort registered websites in the cookie manager on domain  rather than subdomain ,2.0,M
30743.0,415463.0,"Dock menu support for Mac OS X (add ""New Window"" menu item)",dock menu support for mac os x  add  new window  menu item ,545953.0,Add New Window (and New Private Browsing Window) options to Dock Context Menu,add new window  and new private browsing window  options to dock context menu,2.0,M
34435.0,1535711.0,[meta] Pocket New Tab, meta  pocket new tab,1550082.0,[META] Pocket + New Tab Improvements in 69, meta  pocket   new tab improvements in 69,2.0,M
56413.0,1462415.0,Delete onboarding system add-on,delete onboarding system add on,1450809.0,"Make ""Photon Onboarding"" something other than a bootstrapped extension",make  photon onboarding  something other than a bootstrapped extension,2.0,M
28810.0,590448.0,Add context menu to about:sessionrestore items,add context menu to about sessionrestore items,1105220.0,Unable to copy url of tabs in about:sessionrestore,unable to copy url of tabs in about sessionrestore,2.0,M
25152.0,185618.0,Offer choice to open natively with Content-Disposition: attachment (View/Show in browser),offer choice to open natively with content disposition  attachment  view show in browser ,466608.0,Allow opening supported files inside Firefox when download forced,allow opening supported files inside firefox when download forced,2.0,M
46040.0,1409534.0,Replace `AsyncResource` with `fetch`,replace  asyncresource  with  fetch ,836602.0,Firefox Sync doesn't support servers that require TLS client certificates,firefox sync doesn t support servers that require tls client certificates,2.0,M
25948.0,1354046.0,[meta] Implement the OnBoarding overlay, meta  implement the onboarding overlay,1351609.0,Implement the first run page,implement the first run page,2.0,M
33832.0,347680.0,Add Safe Mode option to Session Restore dialogue,add safe mode option to session restore dialogue,349745.0,"Increase discoverability of ""safe mode""",increase discoverability of  safe mode ,2.0,M
16053.0,1402654.0,Allow custom image / thumbnail for an edited top site,allow custom image   thumbnail for an edited top site,1402655.0,Activity Stream Newtab frequent Youtube channel added to Top Sites with generic label,activity stream newtab frequent youtube channel added to top sites with generic label,2.0,M
39288.0,1483335.0,about:preferences should link to about:addons and vice-versa,about preferences should link to about addons and vice versa,1418017.0,"Preferences should contain ""Customize""",preferences should contain  customize ,2.0,M
34582.0,261124.0,"Textbox context menu should have ""Add to Search Bar...""",textbox context menu should have  add to search bar    ,351089.0,"""Add a Keyword for this search"" and ""Manage Search Engines"" integration", add a keyword for this search  and  manage search engines  integration,2.0,M
17363.0,286544.0,bookmark automatic indexing,bookmark automatic indexing,398857.0,permanently cache original content of bookmarks / search bookmarked pages contents.,permanently cache original content of bookmarks   search bookmarked pages contents ,2.0,M
621.0,1174413.0,"[enhancement] Sync should include ""Search Settings""", enhancement  sync should include  search settings ,1250371.0,"Firefox Sync: Couldn't see what's on the server, couldn't find my search engines back",firefox sync  couldn t see what s on the server  couldn t find my search engines back,2.0,M
56791.0,415463.0,"Dock menu support for Mac OS X (add ""New Window"" menu item)",dock menu support for mac os x  add  new window  menu item ,506923.0,"Add ""new window"" menu item to dock Firefox context menu",add  new window  menu item to dock firefox context menu,2.0,M
26030.0,1363757.0,[meta] Photon - Interacting with the AwesomeBar should be fast and smooth, meta  photon   interacting with the awesomebar should be fast and smooth,1425026.0,Awesomebar perf improvements,awesomebar perf improvements,2.0,M
49782.0,1432586.0,[META] Weighted Highlights, meta  weighted highlights,1432584.0,[META] Weighted Highlights, meta  weighted highlights,2.0,M
52295.0,1433177.0,[Meta] New bookmark sync, meta  new bookmark sync,1433182.0,Add a mirror corruption test with a left pane root,add a mirror corruption test with a left pane root,1.0,M
32749.0,1444483.0,[META] Library View, meta  library view,1444501.0,"Add data sources Topsites, Highlights to about:library",add data sources topsites  highlights to about library,1.0,M
54044.0,1486917.0,[meta] Capstone project: convert more parts of the browser to use Fluent, meta  capstone project  convert more parts of the browser to use fluent,1491676.0,Move strings from preferences.properties to Fluent,move strings from preferences properties to fluent,1.0,M
55477.0,1354606.0,"Expose ""opened Inspect Element"" information in UITour.getConfiguration for snippets on about:home",expose  opened inspect element  information in uitour getconfiguration for snippets on about home,1361713.0,Pre-aggregate telemetry data to expose to UITour without impacting performance,pre aggregate telemetry data to expose to uitour without impacting performance,1.0,M
29821.0,1357665.0,[meta] [UX] Photon First Time experiences UX specs, meta   ux  photon first time experiences ux specs,1360461.0,[UX] Pre-Photon In-product message UX Specs, ux  pre photon in product message ux specs,1.0,M
35123.0,1410825.0,"Add automated test for ""Open Top Sites from tiles""",add automated test for  open top sites from tiles ,1437543.0,Fix screenshot request for default topsites,fix screenshot request for default topsites,1.0,M
53297.0,1433177.0,[Meta] New bookmark sync, meta  new bookmark sync,1478918.0,Inflate outgoing records and record observer info outside the bookmarks mirror's merge transaction,inflate outgoing records and record observer info outside the bookmarks mirror s merge transaction,1.0,M
28098.0,70501.0,The middle mouse button should work more consistently (also ctrl+click),the middle mouse button should work more consistently  also ctrl click ,198028.0,"""Go"" toolbar button should respect key modifiers (Shift/Ctrl/Alt)", go  toolbar button should respect key modifiers  shift ctrl alt ,1.0,M
35691.0,1425466.0,[meta] investigate reducing xpconnect overhead based on frontend usage, meta  investigate reducing xpconnect overhead based on frontend usage,1425586.0,Make JS usage of appid (nsIXULAppInfo.ID) not pass through xpconnect all the time,make js usage of appid  nsixulappinfo id  not pass through xpconnect all the time,1.0,M
7778.0,1421690.0,[meta] Storage (Site Data and Cookies) Management V2, meta  storage  site data and cookies  management v2,1442179.0,The website added in the Exceptions list must  have the exact address to take the exception state,the website added in the exceptions list must  have the exact address to take the exception state,1.0,M
5656.0,1538729.0,[META] Message System Router, meta  message system router,1513279.0,[META] Snippets, meta  snippets,1.0,M
18359.0,1535711.0,[meta] Pocket New Tab, meta  pocket new tab,1562277.0,Pocket New Tab - Revisit spoc dismissal flow,pocket new tab   revisit spoc dismissal flow,1.0,M
56532.0,1330635.0,[meta] Sessionstore performance tracking, meta  sessionstore performance tracking,1374354.0,SessionRestore slows down page loading of a new tab,sessionrestore slows down page loading of a new tab,1.0,M
32270.0,1352695.0,[meta] Update the hamburger panel for Photon, meta  update the hamburger panel for photon,1376098.0,[hamburger panel] Remove Page Setup menu item, hamburger panel  remove page setup menu item,1.0,M
48667.0,1480167.0,[meta] Firefox Performance Adjustment - set up a mechanism for various parts of Firefox to adapt based on machine performance characteristics, meta  firefox performance adjustment   set up a mechanism for various parts of firefox to adapt based on machine performance characteristics,1524299.0,Don't detect Intel M processors with varying clock speeds as low-end,don t detect intel m processors with varying clock speeds as low end,1.0,M
43277.0,1574055.0,Generate sphinx docs for the FxA public API.,generate sphinx docs for the fxa public api ,1565960.0,[meta] Improve the public FxA API, meta  improve the public fxa api,1.0,M
51274.0,1545802.0,[META] Trailhead Desktop First Run, meta  trailhead desktop first run,1550566.0,Retrieve `deviceID` parameter from FxA metrics endpoint and append as additional query parameter for FxA flows,retrieve  deviceid  parameter from fxa metrics endpoint and append as additional query parameter for fxa flows,1.0,M
36907.0,1461743.0,[meta] Privacy UI Improvements, meta  privacy ui improvements,1503465.0,Add an async API for retrieving the content blocking log from <xul:browser>,add an async api for retrieving the content blocking log from  xul browser ,1.0,M
7728.0,1504728.0,Add a content blocking notification for indicating when a top-level page is using cookies/site data,add a content blocking notification for indicating when a top level page is using cookies site data,1507353.0,Convert the accesses to security.insecure_connection_icon.* prefs into lazy getters,convert the accesses to security insecure connection icon   prefs into lazy getters,1.0,M
25092.0,1352110.0,"[meta] Create a library button to show Recent Bookmarks, Recent Downloads, History, Synced Tabs, Screenshots, and Pocket List", meta  create a library button to show recent bookmarks  recent downloads  history  synced tabs  screenshots  and pocket list,1354083.0,Add a pref to show a static hamburger menu when enabled,add a pref to show a static hamburger menu when enabled,1.0,M
6324.0,1521707.0,Make a UrlbarTestUtils.jsm helper for tests and move functions from head-common.js into it,make a urlbartestutils jsm helper for tests and move functions from head common js into it,1514164.0,Identify tests failing with the Quantum Bar,identify tests failing with the quantum bar,1.0,M
25935.0,1479806.0,[META] Top Site Search Shortcuts, meta  top site search shortcuts,1483218.0,Add additional descriptive text for search shortcuts for screen readers,add additional descriptive text for search shortcuts for screen readers,1.0,M
11781.0,1479806.0,[META] Top Site Search Shortcuts, meta  top site search shortcuts,1480508.0,Add Top Site Search Shortcuts automatically for new and existing users,add top site search shortcuts automatically for new and existing users,1.0,M
13323.0,1549805.0,[meta] Protection Report, meta  protection report,1561334.0,[meta] Review A11y for protection report, meta  review a11y for protection report,1.0,M
3564.0,1457572.0,[META] Build Process, meta  build process,1428108.0,set browser.newtabpage.activity-stream.debug by default in local builds,set browser newtabpage activity stream debug by default in local builds,1.0,M
38646.0,1433177.0,[Meta] New bookmark sync, meta  new bookmark sync,1433178.0,Write weakly uploaded records back to the mirror,write weakly uploaded records back to the mirror,1.0,M
32962.0,1410333.0,[meta] Add automated tests for Activity Stream functionality, meta  add automated tests for activity stream functionality,1410446.0,"Add automated test for ""New Tab Preferences - Highlights - Enable""",add automated test for  new tab preferences   highlights   enable ,1.0,M
1715.0,1435780.0,[Meta] Firefox launcher process, meta  firefox launcher process,1479057.0,Launcher process: Improved sanity checks in nt::PEHeaders,launcher process  improved sanity checks in nt  peheaders,1.0,M
23908.0,1435780.0,[Meta] Firefox launcher process, meta  firefox launcher process,1488554.0,Enable the launcher process by default on Nightly,enable the launcher process by default on nightly,1.0,M
1535.0,1432588.0,[META] Router Infrastructure, meta  router infrastructure,1483056.0,Add snippets targeting for y/n updates enabled,add snippets targeting for y n updates enabled,1.0,M
15805.0,1479806.0,[META] Top Site Search Shortcuts, meta  top site search shortcuts,1482484.0,Too many pinned links causes RangeError: invalid array length,too many pinned links causes rangeerror  invalid array length,1.0,M
37423.0,1561531.0,[meta] Implement Quantumbar design update behind a pref, meta  implement quantumbar design update behind a pref,1561534.0,Anchor quantumbar results to the input instead of the toolbar (pref'd off),anchor quantumbar results to the input instead of the toolbar  pref d off ,1.0,M
37712.0,1348289.0,[meta] Photon - Improve perceived UI performance in Firefox (bugs for triage), meta  photon   improve perceived ui performance in firefox  bugs for triage ,906076.0,[meta] Virtual tabs - lazily create linkedBrowser and other dependent elements for tabbrowser tabs to improve startup performance, meta  virtual tabs   lazily create linkedbrowser and other dependent elements for tabbrowser tabs to improve startup performance,1.0,M
41318.0,1355956.0,[meta] Photon - Make Firefox start more quickly, meta  photon   make firefox start more quickly,1421456.0,Add a test to prevent flickering regressions on window opening,add a test to prevent flickering regressions on window opening,1.0,M
22323.0,1570565.0,"[meta] Decouple ""Signing in to Firefox"" from ""Enabling Firefox Sync""", meta  decouple  signing in to firefox  from  enabling firefox sync ,1571526.0,Make it clearer how to sign out of Firefox,make it clearer how to sign out of firefox,1.0,M
38724.0,1461743.0,[meta] Privacy UI Improvements, meta  privacy ui improvements,1522565.0,Create a sub-panel for cryptominers and fingerprinters,create a sub panel for cryptominers and fingerprinters,1.0,M
30174.0,1535711.0,[meta] Pocket New Tab, meta  pocket new tab,1573204.0,Discovery Stream pocket stories add one more line to text content,discovery stream pocket stories add one more line to text content,1.0,M
41939.0,1574051.0,Refactor session/account status handling,refactor session account status handling,1574048.0,Remove FxAccounts internal/external/Object.freeze()/ weirdness,remove fxaccounts internal external object freeze    weirdness,1.0,M
18376.0,1549805.0,[meta] Protection Report, meta  protection report,1567261.0,Change tab icon to graph icon on protection report,change tab icon to graph icon on protection report,1.0,M
53596.0,1535711.0,[meta] Pocket New Tab, meta  pocket new tab,1542866.0,[meta] Add server-controllable collapsible sections to Discovery Stream - TBD, meta  add server controllable collapsible sections to discovery stream   tbd,1.0,M
47746.0,1330635.0,[meta] Sessionstore performance tracking, meta  sessionstore performance tracking,1350569.0,Avoid full session history collect for DOMTitleChanged/OnHistoryReload,avoid full session history collect for domtitlechanged onhistoryreload,1.0,M
6254.0,1349422.0,[meta] Photon - Improvements to First-Run Experience, meta  photon   improvements to first run experience,1343510.0,Expose profile/session timestamps/times in UITour.getConfiguration for snippets on about:home,expose profile session timestamps times in uitour getconfiguration for snippets on about home,1.0,M
17543.0,1363750.0,[meta] Photon - Improve perceived UI performance in Firefox, meta  photon   improve perceived ui performance in firefox,1363771.0,[meta] Photon - Eliminate or greatly reduce pauses that can occur randomly in front-end code, meta  photon   eliminate or greatly reduce pauses that can occur randomly in front end code,1.0,M
11982.0,1433315.0,[meta] [EPIC] Activity Stream, meta   epic  activity stream,1457572.0,[META] Build Process, meta  build process,1.0,M
16720.0,1529927.0,Identify which old autocomplete tests should be ported,identify which old autocomplete tests should be ported,1533052.0,Port IME tests from autocomplete,port ime tests from autocomplete,1.0,M
911.0,1505898.0,[meta] Fission for the front-end, meta  fission for the front end,1533950.0,[Fission] Make core functionality from tab-content.js ready for Fission, fission  make core functionality from tab content js ready for fission,1.0,M
32019.0,1433177.0,[Meta] New bookmark sync, meta  new bookmark sync,1557551.0,Disqualify invalid items in the bookmarks mirror from deduping,disqualify invalid items in the bookmarks mirror from deduping,1.0,M
9369.0,1479806.0,[META] Top Site Search Shortcuts, meta  top site search shortcuts,1502975.0,Yandex search shortcut displayed in Russian for Turkish,yandex search shortcut displayed in russian for turkish,1.0,M
548.0,1355956.0,[meta] Photon - Make Firefox start more quickly, meta  photon   make firefox start more quickly,1384714.0,Use subscript loader to load browser.xul scripts,use subscript loader to load browser xul scripts,1.0,M
47246.0,1534775.0,[META] Discovery Stream Performance Improvements - fx68, meta  discovery stream performance improvements   fx68,1544022.0,Adjust prerendering to work with Discovery Stream,adjust prerendering to work with discovery stream,1.0,M
31766.0,1508364.0,New UI for Private Browsing with Search,new ui for private browsing with search,1523117.0,private windows don't respect the user's settings for displaying a search field,private windows don t respect the user s settings for displaying a search field,1.0,M
17749.0,1352697.0,[meta] Add a URL-bar based page action menu, meta  add a url bar based page action menu,1355322.0,Add anchor button to urlbar for action menu,add anchor button to urlbar for action menu,1.0,M
37590.0,1352697.0,[meta] Add a URL-bar based page action menu, meta  add a url bar based page action menu,1363168.0,"Add support for native OS X ""Share"" feature",add support for native os x  share  feature,1.0,M
10211.0,1512725.0,[META] Pocket + New Tab MVP 66/67, meta  pocket   new tab mvp 66 67,1531585.0,[Context Menu] Implement dismiss a story menu option inside pocket new tab, context menu  implement dismiss a story menu option inside pocket new tab,1.0,M
23663.0,1480532.0,Remove “Reload All Tabs” from Tab context menu,remove “reload all tabs” from tab context menu,1480456.0,Implement “Select All Tabs” into tab context menu,implement “select all tabs” into tab context menu,1.0,M
29802.0,1330635.0,[meta] Sessionstore performance tracking, meta  sessionstore performance tracking,1474139.0,Move content-sessionStore.js to a JSM,move content sessionstore js to a jsm,1.0,M
40249.0,1471328.0,[META] CFR Add-ons, meta  cfr add ons,1486779.0,Update doorhanger to reflect new designs,update doorhanger to reflect new designs,1.0,M
9396.0,1565960.0,[meta] Improve the public FxA API, meta  improve the public fxa api,1574048.0,Remove FxAccounts internal/external/Object.freeze()/ weirdness,remove fxaccounts internal external object freeze    weirdness,1.0,M
48619.0,1437659.0,[META] Reduce Backlog, meta  reduce backlog,1437494.0,Add 2 more Default Top Sites in wide view,add 2 more default top sites in wide view,1.0,M
43238.0,240859.0,Full Screen Navigation Bar Should Have Auto Hide,full screen navigation bar should have auto hide,450859.0,"New, blank window in fullscreen mode should show URL bar and bookmarks",new  blank window in fullscreen mode should show url bar and bookmarks,1.0,M
18563,70501,The middle mouse button should work more consistently (also ctrl+click),the middle mouse button should work more consistently  also ctrl click ,1433214,Add ping centre / telemetry probes for user events in AS router templates,add ping centre   telemetry probes for user events in as router templates,0.0,M
29068,106074,Helper App Management,helper app management,1461466,Re-evaluate the telemetry after the Activity Stream Router experiment,re evaluate the telemetry after the activity stream router experiment,0.0,M
21605,152289,new Filepicker filters for Nvu,new filepicker filters for nvu,1435917,Ensure Sync's client properties are reset/updated on profile clone,ensure sync s client properties are reset updated on profile clone,0.0,M
42134,106074,Helper App Management,helper app management,1480535,Make in-content search box more prominent,make in content search box more prominent,0.0,M
56624,106074,Helper App Management,helper app management,1479426,The CSS selector showing pageActionSeparator is pretty inefficient,the css selector showing pageactionseparator is pretty inefficient,0.0,M
15244,191000,[RFE] allow users to override mime type for gz and other suffixes, rfe  allow users to override mime type for gz and other suffixes,1501977,Remove global Content Blocking toggle in the main menu and about:preferences,remove global content blocking toggle in the main menu and about preferences,0.0,M
25304,70501,The middle mouse button should work more consistently (also ctrl+click),the middle mouse button should work more consistently  also ctrl click ,1476683,Audit dependencies with --display-optimization-bailout for 63 [recurring],audit dependencies with   display optimization bailout for 63  recurring ,0.0,M
21819,125419,"[META]Add AppleScript support and capabilities to Mozilla on Mac, e.g. AppleScript/OSA Script menu", meta add applescript support and capabilities to mozilla on mac  e g  applescript osa script menu,1459772,pre-render locales in mc using node script,pre render locales in mc using node script,0.0,M
29682,106074,Helper App Management,helper app management,1528966,Add new CFR UI template for Pin tab and message schema,add new cfr ui template for pin tab and message schema,0.0,M
1098,125419,"[META]Add AppleScript support and capabilities to Mozilla on Mac, e.g. AppleScript/OSA Script menu", meta add applescript support and capabilities to mozilla on mac  e g  applescript osa script menu,1477312,"Add a test for showing the ""what can you do about it"" section on the right error pages",add a test for showing the  what can you do about it  section on the right error pages,0.0,M
41894,106074,Helper App Management,helper app management,1515285,switch to tab only works with the mouse,switch to tab only works with the mouse,0.0,M
19858,106074,Helper App Management,helper app management,1446940,Replace window...QueryInterface(Ci.nsIDocShell) usage with window.document.docShell,replace window   queryinterface ci nsidocshell  usage with window document docshell,0.0,M
12317,106074,Helper App Management,helper app management,1431469,Expose last session end timestamp to snippets,expose last session end timestamp to snippets,0.0,M
27508,70501,The middle mouse button should work more consistently (also ctrl+click),the middle mouse button should work more consistently  also ctrl click ,1367242,[Photon] Implement new styling for header and search box of bookmarks/history sidebar., photon  implement new styling for header and search box of bookmarks history sidebar ,0.0,M
40452,106074,Helper App Management,helper app management,1572556,pref for DS 69 mitigation strategy,pref for ds 69 mitigation strategy,0.0,M
30468,152289,new Filepicker filters for Nvu,new filepicker filters for nvu,1571843,Deploy test nightly Moments remote settings messages,deploy test nightly moments remote settings messages,0.0,M
41659,106074,Helper App Management,helper app management,1520833,Quantumbar history results show the URL instead of the title,quantumbar history results show the url instead of the title,0.0,M
37740,115041,support %u in mailcap helpers,support  u in mailcap helpers,1505319,Remove --cfr-notification-header-image and --cfr-notification-footer-star variables,remove   cfr notification header image and   cfr notification footer star variables,0.0,M
17339,185618,Offer choice to open natively with Content-Disposition: attachment (View/Show in browser),offer choice to open natively with content disposition  attachment  view show in browser ,1364896,Browser chrome: increase margin of context menus when they are triggered with touch (as we do with context menus in content),browser chrome  increase margin of context menus when they are triggered with touch  as we do with context menus in content ,0.0,M
4112,106074,Helper App Management,helper app management,1385453,"Make it possible for async tab switcher to ""warm up"" tabs that are likely to be displayed soon",make it possible for async tab switcher to  warm up  tabs that are likely to be displayed soon,0.0,M
23797,115041,support %u in mailcap helpers,support  u in mailcap helpers,1410832,"Add automated test for ""Top Sites - Context menu - Pin item""",add automated test for  top sites   context menu   pin item ,0.0,M
4097,125419,"[META]Add AppleScript support and capabilities to Mozilla on Mac, e.g. AppleScript/OSA Script menu", meta add applescript support and capabilities to mozilla on mac  e g  applescript osa script menu,1368414,Convert skin/classic/global/icons/calendar-arrows.svg to use context paint and avoid filtering to improve performance,convert skin classic global icons calendar arrows svg to use context paint and avoid filtering to improve performance,0.0,M
19797,142179,"Cookie Manager: sort ""Cookie Sites"" should sort by Domain (TLD -> left, as labels, not strings, etc.)",cookie manager  sort  cookie sites  should sort by domain  tld    left  as labels  not strings  etc  ,342916,Index full text of pages as they are bookmarked,index full text of pages as they are bookmarked,0.0,M
